{
  "$schema": "https://json-schema.org/draft/2020-12/schema",
  "$id": "urn:md2hwp:schema:ast2ir-rules",
  "title": "md2hwp AST-to-IR rules targeting the current IR",
  "description": "Closed structure for the product-owned Pandoc AST-to-IR normalization ruleset.",
  "type": "object",
  "additionalProperties": false,
  "required": [
    "schema",
    "target_ir",
    "unlisted_constructor",
    "document",
    "blocks",
    "inlines"
  ],
  "properties": {
    "schema": {
      "const": "md2hwp.ast2ir-rules"
    },
    "target_ir": {
      "type": "object",
      "additionalProperties": false,
      "required": [
        "schema",
        "version"
      ],
      "properties": {
        "schema": {
          "const": "md2hwp.ir"
        },
        "version": {
          "const": "0.4"
        }
      }
    },
    "unlisted_constructor": {
      "const": "reject"
    },
    "document": {
      "type": "object",
      "additionalProperties": false,
      "required": [
        "metadata",
        "object_sources"
      ],
      "properties": {
        "metadata": {
          "const": "require_empty"
        },
        "object_sources": {
          "const": {
            "separator": "space",
            "owners": [
              "figure",
              "verbatim_block",
              "table"
            ],
            "empty": "reject",
            "handler": "adjacent_paragraph",
            "prefixes": [
              "출처",
              "주",
              "주석",
              "참고",
              "자료",
              "설명",
              "비고",
              "단위",
              "기준",
              "해설",
              "약어",
              "참조",
              "주의",
              "작성",
              "제공",
              "재구성",
              "번역",
              "source",
              "src",
              "note",
              "annotation",
              "annot",
              "reference",
              "ref",
              "data",
              "description",
              "desc",
              "remark",
              "remarks",
              "unit",
              "basis",
              "commentary",
              "cmt",
              "abbreviation",
              "abbr",
              "credit",
              "translation",
              "trans"
            ],
            "numbered_prefixes": [
              "주",
              "주석",
              "note"
            ]
          }
        }
      }
    },
    "blocks": {
      "$ref": "#/$defs/blocks"
    },
    "inlines": {
      "$ref": "#/$defs/inlines"
    }
  },
  "$defs": {
    "blocks": {
      "type": "object",
      "additionalProperties": false,
      "minProperties": 1,
      "properties": {
        "Para": {
          "type": "object",
          "additionalProperties": false,
          "required": [
            "handler",
            "figure"
          ],
          "properties": {
            "handler": {
              "const": "paragraph"
            },
            "figure": {
              "const": {
                "attributes": "optional_id_only",
                "context": "document_only",
                "handler": "standalone_image",
                "caption": "alt"
              }
            }
          }
        },
        "Figure": {
          "const": {
            "handler": "figure",
            "attributes": "optional_id_only",
            "caption": "single_paragraph",
            "content": "single_image"
          }
        },
        "Header": {
          "type": "object",
          "additionalProperties": false,
          "required": [
            "handler",
            "minimum_level",
            "maximum_level",
            "attributes"
          ],
          "properties": {
            "handler": {
              "const": "heading"
            },
            "minimum_level": {
              "type": "integer",
              "minimum": 1,
              "maximum": 6
            },
            "maximum_level": {
              "type": "integer",
              "minimum": 1,
              "maximum": 6
            },
            "attributes": {
              "const": "optional_id_only"
            }
          }
        },
        "Plain": {
          "type": "object",
          "additionalProperties": false,
          "required": [
            "handler",
            "context"
          ],
          "properties": {
            "handler": {
              "const": "list_item_paragraph"
            },
            "context": {
              "const": "list_item_only"
            }
          }
        },
        "CodeBlock": {
          "type": "object",
          "additionalProperties": false,
          "required": [
            "handler",
            "attributes"
          ],
          "properties": {
            "handler": {
              "const": "verbatim_block"
            },
            "attributes": {
              "const": "require_empty"
            }
          }
        },
        "BulletList": {
          "type": "object",
          "additionalProperties": false,
          "required": [
            "handler"
          ],
          "properties": {
            "handler": {
              "const": "bullet_list"
            }
          }
        },
        "OrderedList": {
          "type": "object",
          "additionalProperties": false,
          "required": [
            "handler",
            "minimum_start",
            "number_styles",
            "delimiters"
          ],
          "properties": {
            "handler": {
              "const": "ordered_list"
            },
            "minimum_start": {
              "type": "integer",
              "minimum": 1
            },
            "number_styles": {
              "type": "array",
              "minItems": 1,
              "uniqueItems": true,
              "items": {
                "enum": [
                  "DefaultStyle",
                  "Decimal"
                ]
              }
            },
            "delimiters": {
              "type": "array",
              "minItems": 1,
              "uniqueItems": true,
              "items": {
                "enum": [
                  "DefaultDelim",
                  "Period",
                  "OneParen"
                ]
              }
            }
          }
        },
        "Table": {
          "type": "object",
          "additionalProperties": false,
          "required": [
            "handler",
            "attributes"
          ],
          "properties": {
            "handler": {
              "const": "table"
            },
            "attributes": {
              "const": "require_empty"
            }
          }
        }
      }
    },
    "inlines": {
      "type": "object",
      "additionalProperties": false,
      "minProperties": 1,
      "properties": {
        "Note": {
          "$ref": "#/$defs/footnote_handler"
        },
        "Str": {
          "$ref": "#/$defs/text_handler"
        },
        "Space": {
          "$ref": "#/$defs/space_handler"
        },
        "SoftBreak": {
          "$ref": "#/$defs/soft_break_handler"
        },
        "LineBreak": {
          "$ref": "#/$defs/line_break_handler"
        },
        "Strong": {
          "$ref": "#/$defs/strong_handler"
        },
        "Emph": {
          "$ref": "#/$defs/emph_handler"
        },
        "Link": {
          "type": "object",
          "additionalProperties": false,
          "required": [
            "handler",
            "attributes",
            "target",
            "absent_title",
            "internal_target"
          ],
          "properties": {
            "handler": {
              "const": "link"
            },
            "attributes": {
              "const": "require_empty"
            },
            "target": {
              "const": "require_nonempty"
            },
            "absent_title": {
              "const": "null"
            },
            "internal_target": {
              "const": "resolve_heading_or_figure"
            }
          }
        }
      }
    },
    "footnote_handler": {
      "type": "object",
      "additionalProperties": false,
      "required": [
        "handler"
      ],
      "properties": {
        "handler": {
          "const": "footnote"
        }
      }
    },
    "text_handler": {
      "type": "object",
      "additionalProperties": false,
      "required": [
        "handler"
      ],
      "properties": {
        "handler": {
          "const": "text"
        }
      }
    },
    "space_handler": {
      "type": "object",
      "additionalProperties": false,
      "required": [
        "handler"
      ],
      "properties": {
        "handler": {
          "const": "space"
        }
      }
    },
    "soft_break_handler": {
      "type": "object",
      "additionalProperties": false,
      "required": [
        "handler"
      ],
      "properties": {
        "handler": {
          "enum": [
            "space",
            "line_break",
            "reject"
          ]
        }
      }
    },
    "line_break_handler": {
      "type": "object",
      "additionalProperties": false,
      "required": [
        "handler"
      ],
      "properties": {
        "handler": {
          "const": "line_break"
        }
      }
    },
    "strong_handler": {
      "type": "object",
      "additionalProperties": false,
      "required": [
        "handler"
      ],
      "properties": {
        "handler": {
          "const": "strong"
        }
      }
    },
    "emph_handler": {
      "type": "object",
      "additionalProperties": false,
      "required": [
        "handler"
      ],
      "properties": {
        "handler": {
          "const": "emph"
        }
      }
    }
  }
}
